,created_at,headline,symbols,Impact Score
0,2023-01-13T21:27:51Z,"Top 15 Trending Stocks On WallStreetBets As Of Friday, Jan. 13, 2023 (Via Swaggy Stocks)","['AAPL', 'AI', 'AMZN', 'BBBY', 'COIN', 'CVNA', 'GLD', 'JPM', 'NEGG', 'NFLX', 'NVDA', 'QQQ', 'SLV', 'SPCE', 'TSLA']",72
1,2023-01-13T17:41:11Z,10 Information Technology Stocks Whale Activity In Today's Session,"['AAPL', 'AMD', 'DELL', 'MARA', 'NVDA', 'QCOM', 'TACT', 'TXN', 'ZM', 'ZS']",85
2,2023-01-13T15:46:54Z,Top-Performing Hedge Fund In 2022 Has This Strategy To Thank: How Much Did It Make Last Year?,"['AAPL', 'ABBV', 'BAC', 'CRM', 'EQT', 'FXI', 'HYG', 'LLY', 'MSFT', 'NVDA', 'PINS', 'QQQ', 'SWN', 'TSM', 'XLE', 'XLF']",78
3,2023-01-13T14:19:06Z,"Rosenblatt Maintains Buy on Apple, Lowers Price Target to $165",['AAPL'],55
4,2023-01-13T14:01:54Z,"Benzinga Pro's Top 5 Stocks To Watch For Friday, January 13, 2023: AAPL, NFLX, WEN, PANW, APRN","['AAPL', 'APRN', 'NFLX', 'PANW', 'WEN']",78
5,2023-01-13T06:00:13Z,iPhone's Long-Term Prospects Intact But Here's Why Analyst Still Expects Apple To Give Soft Outlook On Feb. 2,"['AAPL', 'TSM']",78
6,2023-01-13T02:19:21Z,Why Apple CEO Tim Cook Is Staring At A Big Pay Cut In 2023,['AAPL'],78
7,2023-01-13T01:07:44Z,"Tesla, Amazon, Apple, Bed Bath & Beyond, Marathon Digital: Why These 5 Stocks Are Drawing Investors' Attention Today","['AAPL', 'AMZN', 'BBBY', 'BTCUSD', 'ETHUSD', 'MARA', 'TSLA']",79
